{
  "schemaVersion": "901-resource/1",
  "id": "imperial-magic:C:阳炎炮",
  "version": "2026-10-23.1",
  "identity": {
    "name": "阳炎炮",
    "grade": "C",
    "category": "spell",
    "tree": "imperial"
  },
  "reading": {
    "path": "resources/imperial-magic/01-塑能.md",
    "sha256": "8ada5f178afeea3f5ed53e580b3b0dd91b6a09cdcce30a423b06403d0cb0d209",
    "heading": "阳炎炮"
  },
  "definition": {
    "source": "resources/imperial-magic/01-塑能.md",
    "grade": "C",
    "prohibited": false,
    "subskills": [
      "塑能"
    ],
    "effects": [],
    "learning": {
      "baseXP": 25,
      "requiresKnownVersion": false
    },
    "programs": {
      "cast": {
        "action": "standard",
        "target": "single",
        "casting": true,
        "components": [
          "posture",
          "language",
          "focus"
        ],
        "range": {
          "op": "mul",
          "args": [
            10,
            {
              "context": "INT"
            },
            {
              "context": "P"
            }
          ]
        },
        "steps": [
          {
            "op": "attack",
            "weapon": {
              "op": "floor",
              "args": [
                {
                  "op": "div",
                  "args": [
                    {
                      "op": "mul",
                      "args": [
                        5,
                        {
                          "context": "P"
                        }
                      ]
                    },
                    3
                  ]
                }
              ]
            },
            "ap": {
              "op": "mul",
              "args": [
                2,
                {
                  "context": "P"
                }
              ]
            },
            "magic": {
              "op": "mul",
              "args": [
                2,
                {
                  "context": "P"
                }
              ]
            },
            "speed": {
              "op": "mul",
              "args": [
                2,
                {
                  "context": "P"
                }
              ]
            },
            "contact": true,
            "energyWeapon": true
          },
          {
            "op": "damage",
            "amount": {
              "context": "damage"
            },
            "energy": "pure",
            "severity": "L",
            "energyWeapon": true,
            "weapon": {
              "op": "floor",
              "args": [
                {
                  "op": "div",
                  "args": [
                    {
                      "op": "mul",
                      "args": [
                        5,
                        {
                          "context": "P"
                        }
                      ]
                    },
                    3
                  ]
                }
              ]
            }
          }
        ],
        "cooldown": 1
      }
    },
    "schools": [
      "塑能"
    ],
    "requiresAllSchools": false
  },
  "clauses": [
    {
      "heading": "阳炎炮",
      "effectStats": [],
      "status": "partial"
    }
  ],
  "actions": [
    {
      "id": "cast",
      "name": "阳炎炮",
      "operation": "cast",
      "actionCost": "standard",
      "requiredChoice": "actual-targets",
      "choices": {},
      "allocations": [],
      "targetMode": "single",
      "requestFields": [
        "actorId",
        "objectId",
        "operation",
        "part"
      ],
      "allowsModelNumericEffects": false,
      "route": "mechanism",
      "objectType": "kitResource",
      "immunityLifecycles": [],
      "resistanceModes": []
    }
  ],
  "inputs": [
    {
      "id": "ownership",
      "type": "object",
      "provider": "saved-state",
      "requiredFor": "cast",
      "missingPolicy": "require_input_for_dependent_action"
    },
    {
      "id": "casting",
      "type": "object",
      "provider": "saved-state",
      "requiredFor": "cast",
      "missingPolicy": "require_input_for_dependent_action"
    },
    {
      "id": "targetIds",
      "type": "array",
      "provider": "player",
      "requiredFor": "cast",
      "missingPolicy": "require_input_for_dependent_action"
    },
    {
      "id": "components",
      "type": "object",
      "provider": "host",
      "requiredFor": "cast",
      "missingPolicy": "require_input_for_dependent_action"
    },
    {
      "id": "pool",
      "type": "string",
      "provider": "player",
      "requiredFor": "cast",
      "missingPolicy": "require_input_for_dependent_action"
    }
  ],
  "unresolvedRules": [],
  "implementationGaps": [
    "贯穿链的逐目标预算",
    "需执行级完整验证，检查等级/特殊关键词/版本变体；不可仅凭程序存在标记完成"
  ],
  "verification": {
    "status": "partial",
    "sourceChecked": true,
    "runtimeFullyVerified": false
  }
}
