{
  "schemaVersion": "901-resource/1",
  "id": "imperial-magic:C:茜卓的旋炎咒",
  "version": "2026-10-23.1",
  "identity": {
    "name": "茜卓的旋炎咒",
    "grade": "C",
    "category": "spell",
    "tree": "imperial"
  },
  "reading": {
    "path": "resources/imperial-magic/01-塑能.md",
    "sha256": "59608609417e520c2328fd4593a42d9da86064c47b1e226911f670bb0dd636eb",
    "heading": "茜卓的旋炎咒"
  },
  "definition": {
    "source": "resources/imperial-magic/01-塑能.md",
    "grade": "C",
    "prohibited": false,
    "subskills": [
      "塑能"
    ],
    "effects": [],
    "learning": {
      "baseXP": 25,
      "requiresKnownVersion": false
    },
    "requiresAllSchools": false,
    "schools": [
      "塑能"
    ]
  },
  "clauses": [
    {
      "heading": "茜卓的旋炎咒",
      "effectStats": [],
      "status": "pending"
    }
  ],
  "actions": [],
  "inputs": [],
  "unresolvedRules": [],
  "implementationGaps": [
    "结构化逐条效果与运行接口尚须完成；属于实现工作，不是待裁定"
  ],
  "verification": {
    "status": "pending",
    "sourceChecked": true,
    "runtimeFullyVerified": false
  }
}
