{
  "schemaVersion": "901-resource/1",
  "id": "huang.exorcist",
  "version": "2026-10-23.1",
  "identity": {
    "name": "特殊身份1·除灵师",
    "grade": null,
    "category": "resource",
    "tree": null
  },
  "reading": {
    "path": "outputs/同伴RE资源调整/黄泉.md",
    "sha256": "f58a4ec2c4cf33b9447c698f5088410e3e7346a5d977a419f0bebe6765fef6e3",
    "heading": "特殊身份1·除灵师",
    "headingDepth": 2
  },
  "definition": {
    "source": "outputs/同伴RE资源调整/黄泉.md",
    "grade": null,
    "prohibited": false,
    "subskills": [],
    "effects": []
  },
  "clauses": [
    {
      "heading": "特殊身份1·除灵师",
      "effectStats": [],
      "status": "pending"
    }
  ],
  "actions": [],
  "inputs": [],
  "unresolvedRules": [],
  "implementationGaps": [
    "结构化逐条效果与运行接口尚须完成；属于实现工作，不是待裁定"
  ],
  "verification": {
    "status": "pending",
    "sourceChecked": true,
    "runtimeFullyVerified": false
  }
}
