{
  "schemaVersion": "901-resource/1",
  "id": "bright.improved_initiative",
  "version": "2026-10-25.4",
  "identity": {
    "name": "精通先攻2级",
    "grade": null,
    "category": "resource",
    "tree": null
  },
  "reading": {
    "path": "outputs/同伴RE资源调整/布莱特.md",
    "sha256": "ddbc3354a9a21fd4231f9a55a64bfddd33c1212183f6cbed21d7b3419f31dd8d",
    "heading": "精通先攻2级",
    "headingDepth": 2
  },
  "definition": {
    "source": "outputs/同伴RE资源调整/布莱特.md",
    "grade": null,
    "prohibited": false,
    "subskills": [],
    "effects": [
      {
        "stat": "initiative",
        "value": 4,
        "group": "feat"
      },
      {
        "stat": "initiativeDefense",
        "value": 5,
        "group": "feat",
        "clauseId": "initiative-defense"
      }
    ],
    "legacyProfile": {
      "ruleset": "opening-20261022",
      "kind": "bright",
      "add": {
        "initiative": -3
      },
      "set": {
        "initiativeDefense": 0
      }
    },
    "capabilities": [
      {
        "id": "initiativeTiePriority",
        "level": 1
      }
    ]
  },
  "clauses": [
    {
      "heading": "精通先攻2级",
      "effectStats": [],
      "status": "partial"
    }
  ],
  "actions": [],
  "inputs": [],
  "unresolvedRules": [],
  "implementationGaps": [
    "被动运行效果已接入，取得前提及所有相关动作路径仍须完整验证"
  ],
  "verification": {
    "status": "partial",
    "sourceChecked": true,
    "runtimeFullyVerified": false,
    "testReferences": [
      "work/rules_engine/resource-effects.test.mjs",
      "work/rules_engine/combat/declarative-actions.test.mjs"
    ]
  }
}
