{
  "schemaVersion": "901-resource/1",
  "id": "imperial-magic:D:遗体防腐",
  "version": "2026-10-23.1",
  "identity": {
    "name": "遗体防腐",
    "grade": "D",
    "category": "spell",
    "tree": "imperial"
  },
  "reading": {
    "path": "resources/imperial-magic/04-结界与召唤.md",
    "sha256": "dc2c01ebd19c5cea1610fe4cfc2433805eaf289a2ad461fbc0cfa4df59167b80",
    "heading": "遗体防腐"
  },
  "definition": {
    "source": "resources/imperial-magic/04-结界与召唤.md",
    "grade": "D",
    "prohibited": false,
    "subskills": [
      "结界"
    ],
    "effects": [],
    "learning": {
      "baseXP": 10,
      "requiresKnownVersion": false,
      "upgradeC": {
        "retainD": 25,
        "replaceD": 15
      }
    },
    "requiresAllSchools": false,
    "schools": [
      "结界"
    ]
  },
  "clauses": [
    {
      "heading": "遗体防腐",
      "effectStats": [],
      "status": "pending"
    }
  ],
  "actions": [],
  "inputs": [],
  "unresolvedRules": [],
  "implementationGaps": [
    "结构化逐条效果与运行接口尚须完成；属于实现工作，不是待裁定"
  ],
  "verification": {
    "status": "pending",
    "sourceChecked": true,
    "runtimeFullyVerified": false
  }
}
