{
  "schemaVersion": "901-resource/1",
  "id": "imperial-magic:D:送入梦乡",
  "version": "2026-10-24.4",
  "identity": {
    "name": "送入梦乡",
    "grade": "D",
    "category": "spell",
    "tree": "imperial"
  },
  "reading": {
    "path": "resources/imperial-magic/05-精神与幻术.md",
    "sha256": "3bd05efeac6dc203de20098676817cac1d2ccbfdc05288c2b5f9b951d1c570e3",
    "heading": "送入梦乡"
  },
  "definition": {
    "source": "resources/imperial-magic/05-精神与幻术.md",
    "grade": "D",
    "prohibited": false,
    "subskills": [
      "心灵"
    ],
    "effects": [],
    "learning": {
      "baseXP": 10,
      "requiresKnownVersion": false,
      "upgradeC": {
        "retainD": 25,
        "replaceD": 15
      }
    },
    "requiresAllSchools": false,
    "schools": [
      "心灵"
    ],
    "programs": {
      "cast": {
        "action": "standard",
        "target": "single",
        "casting": true,
        "components": [
          "posture",
          "language",
          "focus"
        ],
        "range": {
          "op": "mul",
          "args": [
            10,
            {
              "context": "INT"
            },
            {
              "context": "P"
            }
          ]
        },
        "steps": [
          {
            "op": "status",
            "type": "欲眠",
            "points": {
              "op": "add",
              "args": [
                {
                  "context": "P"
                },
                1
              ]
            },
            "gradeBonus": 1,
            "component": "main",
            "immunityLifecycle": "suppress-existing"
          }
        ],
        "effectTypes": [
          "mind"
        ],
        "effectGradeBonus": 1,
        "effectComponents": {
          "main": {
            "families": [
              "mind",
              "status:欲眠"
            ],
            "gradeBonus": 1,
            "mode": "any-blocks"
          }
        }
      }
    }
  },
  "clauses": [
    {
      "heading": "送入梦乡",
      "effectStats": [],
      "status": "partial"
    }
  ],
  "actions": [
    {
      "id": "cast",
      "name": "送入梦乡",
      "operation": "cast",
      "actionCost": "standard",
      "requiredChoice": "actual-targets",
      "choices": {},
      "allocations": [],
      "targetMode": "single",
      "requestFields": [
        "actorId",
        "objectId",
        "operation",
        "part"
      ],
      "allowsModelNumericEffects": false,
      "route": "mechanism",
      "objectType": "kitResource",
      "effectComponents": {
        "main": {
          "families": [
            "mind",
            "status:欲眠"
          ],
          "gradeBonus": 1,
          "mode": "any-blocks"
        }
      },
      "immunityLifecycles": [
        {
          "operation": "status",
          "component": "main",
          "policy": "suppress-existing"
        }
      ],
      "resistanceModes": []
    }
  ],
  "inputs": [
    {
      "id": "ownership",
      "type": "object",
      "provider": "saved-state",
      "requiredFor": "cast",
      "missingPolicy": "require_input_for_dependent_action"
    },
    {
      "id": "casting",
      "type": "object",
      "provider": "saved-state",
      "requiredFor": "cast",
      "missingPolicy": "require_input_for_dependent_action"
    },
    {
      "id": "targetIds",
      "type": "array",
      "provider": "player",
      "requiredFor": "cast",
      "missingPolicy": "require_input_for_dependent_action"
    },
    {
      "id": "components",
      "type": "object",
      "provider": "host",
      "requiredFor": "cast",
      "missingPolicy": "require_input_for_dependent_action"
    },
    {
      "id": "pool",
      "type": "string",
      "provider": "player",
      "requiredFor": "cast",
      "missingPolicy": "require_input_for_dependent_action"
    }
  ],
  "unresolvedRules": [],
  "implementationGaps": [
    "需执行级完整验证，检查等级/特殊关键词/版本变体；不可仅凭程序存在标记完成"
  ],
  "verification": {
    "status": "partial",
    "sourceChecked": true,
    "runtimeFullyVerified": false,
    "testReferences": [
      "work/rules_engine/resource-applicability.test.mjs",
      "work/rules_engine/resource-resistance.test.mjs",
      "work/rules_engine/gm_runtime/resource-program.test.mjs",
      "work/rules_engine/resource-status-applicability.test.mjs"
    ]
  }
}
