{
  "schemaVersion": "901-resource/1",
  "id": "imperial-magic:C:鹰眼术",
  "version": "2026-10-23.1",
  "identity": {
    "name": "鹰眼术",
    "grade": "C",
    "category": "spell",
    "tree": "imperial"
  },
  "reading": {
    "path": "resources/imperial-magic/06-预言与诅咒.md",
    "sha256": "be6fce45599359c7eea27ce5327c0c273e0e4d87174d0815c53d6a9cefe733b6",
    "heading": "鹰眼术"
  },
  "definition": {
    "source": "resources/imperial-magic/06-预言与诅咒.md",
    "grade": "C",
    "prohibited": false,
    "subskills": [
      "预言"
    ],
    "effects": [],
    "learning": {
      "baseXP": 25,
      "requiresKnownVersion": false
    },
    "requiresAllSchools": false,
    "schools": [
      "预言"
    ]
  },
  "clauses": [
    {
      "heading": "鹰眼术",
      "effectStats": [],
      "status": "pending"
    }
  ],
  "actions": [],
  "inputs": [],
  "unresolvedRules": [],
  "implementationGaps": [
    "结构化逐条效果与运行接口尚须完成；属于实现工作，不是待裁定"
  ],
  "verification": {
    "status": "pending",
    "sourceChecked": true,
    "runtimeFullyVerified": false
  }
}
