{
  "schemaVersion": "901-resource/1",
  "id": "bright.alertness",
  "version": "2026-10-23.1",
  "identity": {
    "name": "警觉1级",
    "grade": null,
    "category": "resource",
    "tree": null
  },
  "reading": {
    "path": "outputs/同伴RE资源调整/布莱特.md",
    "sha256": "ddbc3354a9a21fd4231f9a55a64bfddd33c1212183f6cbed21d7b3419f31dd8d",
    "heading": "警觉1级",
    "headingDepth": 2
  },
  "definition": {
    "source": "outputs/同伴RE资源调整/布莱特.md",
    "grade": null,
    "prohibited": false,
    "subskills": [],
    "effects": [],
    "capabilities": [
      {
        "id": "flatFootedImmunity",
        "level": 1,
        "grade": "D"
      }
    ]
  },
  "clauses": [
    {
      "heading": "警觉1级",
      "effectStats": [],
      "status": "partial"
    }
  ],
  "actions": [],
  "inputs": [],
  "unresolvedRules": [],
  "implementationGaps": [
    "被动运行效果已接入，取得前提及所有相关动作路径仍须完整验证"
  ],
  "verification": {
    "status": "partial",
    "sourceChecked": true,
    "runtimeFullyVerified": false
  }
}
