{
  "schemaVersion": "901-resource/1",
  "id": "imperial-magic:D:魔法飞弹",
  "version": "2026-10-23.1",
  "identity": {
    "name": "魔法飞弹",
    "grade": "D",
    "category": "spell",
    "tree": "imperial"
  },
  "reading": {
    "path": "resources/imperial-magic/01-塑能.md",
    "sha256": "59608609417e520c2328fd4593a42d9da86064c47b1e226911f670bb0dd636eb",
    "heading": "魔法飞弹"
  },
  "definition": {
    "source": "resources/imperial-magic/01-塑能.md",
    "grade": "D",
    "prohibited": false,
    "subskills": [
      "塑能"
    ],
    "effects": [],
    "learning": {
      "baseXP": 10,
      "requiresKnownVersion": false,
      "upgradeC": {
        "retainD": 25,
        "replaceD": 15
      }
    },
    "programs": {
      "cast": {
        "action": "standard",
        "target": "single",
        "casting": true,
        "components": [
          "posture",
          "language",
          "focus"
        ],
        "range": {
          "op": "mul",
          "args": [
            10,
            {
              "context": "INT"
            },
            {
              "context": "P"
            }
          ]
        },
        "steps": [
          {
            "op": "damage",
            "amount": {
              "op": "add",
              "args": [
                {
                  "op": "floor",
                  "args": [
                    {
                      "op": "div",
                      "args": [
                        {
                          "op": "mul",
                          "args": [
                            1,
                            {
                              "context": "P"
                            }
                          ]
                        },
                        3
                      ]
                    }
                  ]
                },
                {
                  "context": "legendaryINT"
                }
              ]
            },
            "energy": "force",
            "severity": "L"
          }
        ],
        "cooldown": 1
      }
    },
    "schools": [
      "塑能"
    ],
    "requiresAllSchools": false
  },
  "clauses": [
    {
      "heading": "魔法飞弹",
      "effectStats": [],
      "status": "partial"
    }
  ],
  "actions": [
    {
      "id": "cast",
      "name": "魔法飞弹",
      "operation": "cast",
      "actionCost": "standard",
      "requiredChoice": "actual-targets",
      "requestFields": [
        "actorId",
        "objectId",
        "operation",
        "part"
      ],
      "allowsModelNumericEffects": false,
      "route": "mechanism",
      "objectType": "kitResource"
    }
  ],
  "inputs": [
    {
      "id": "ownership",
      "type": "object",
      "provider": "saved-state",
      "requiredFor": "cast",
      "missingPolicy": "require_input_for_dependent_action"
    },
    {
      "id": "casting",
      "type": "object",
      "provider": "saved-state",
      "requiredFor": "cast",
      "missingPolicy": "require_input_for_dependent_action"
    },
    {
      "id": "targetIds",
      "type": "array",
      "provider": "player",
      "requiredFor": "cast",
      "missingPolicy": "require_input_for_dependent_action"
    },
    {
      "id": "components",
      "type": "object",
      "provider": "host",
      "requiredFor": "cast",
      "missingPolicy": "require_input_for_dependent_action"
    },
    {
      "id": "pool",
      "type": "string",
      "provider": "player",
      "requiredFor": "cast",
      "missingPolicy": "require_input_for_dependent_action"
    }
  ],
  "unresolvedRules": [],
  "implementationGaps": [
    "多枚、悬浮与穿透进化需专用声明和投射物事件",
    "需执行级完整验证，检查等级/特殊关键词/版本变体；不可仅凭程序存在标记完成"
  ],
  "verification": {
    "status": "partial",
    "sourceChecked": true,
    "runtimeFullyVerified": false
  }
}
