{
  "schemaVersion": "901-resource/1",
  "id": "kuanglan",
  "version": "2026-10-23.1",
  "identity": {
    "name": "启剑式·风·狂岚",
    "grade": null,
    "category": "resource",
    "tree": null
  },
  "reading": {
    "path": "resources/kuanglan.md",
    "sha256": "c00fad566f7215f546207774c86e4363270f7f7387fb60a3cfad56a9a2504f25"
  },
  "definition": {
    "source": "resources/kuanglan.md",
    "grade": null,
    "prohibited": false,
    "subskills": [],
    "effects": []
  },
  "clauses": [],
  "actions": [],
  "inputs": [],
  "unresolvedRules": [],
  "implementationGaps": [
    "结构化逐条效果与运行接口尚须完成；属于实现工作，不是待裁定"
  ],
  "verification": {
    "status": "pending",
    "sourceChecked": true,
    "runtimeFullyVerified": false
  }
}
