{
  "schemaVersion": "901-resource/1",
  "id": "jiang.steel_body",
  "version": "2026-10-23.1",
  "identity": {
    "name": "钢筋铁骨",
    "grade": "D",
    "category": "resource",
    "tree": null
  },
  "reading": {
    "path": "outputs/同伴RE资源调整/姜子尤.md",
    "sha256": "73a04eab192a03cfb000f7dbdee3e1b95caad7e0c4d9ae11482aa6408706ded5",
    "heading": "钢筋铁骨",
    "headingDepth": 2
  },
  "definition": {
    "source": "outputs/同伴RE资源调整/姜子尤.md",
    "grade": "D",
    "prohibited": false,
    "subskills": [],
    "effects": []
  },
  "clauses": [
    {
      "heading": "钢筋铁骨",
      "effectStats": [],
      "status": "pending"
    }
  ],
  "actions": [],
  "inputs": [],
  "unresolvedRules": [],
  "implementationGaps": [
    "结构化逐条效果与运行接口尚须完成；属于实现工作，不是待裁定"
  ],
  "verification": {
    "status": "pending",
    "sourceChecked": true,
    "runtimeFullyVerified": false
  }
}
